{
  "log_id": "91919191-9191-4191-8191-919191919191",
  "log_seq": 42,
  "timestamp": "2026-08-11T19:00:00+08:00",
  "level": "info",
  "priority": "p3",
  "component": "quant-domain",
  "event_code": "context.capture.accepted",
  "project_id": "22222222-2222-4222-8222-222222222222",
  "activity_id": "33333333-3333-4333-8333-333333333333",
  "session_id": "pi:session:m1-a",
  "task_id": null,
  "job_id": null,
  "run_id": null,
  "correlation_id": "44444444-4444-4444-8444-444444444444",
  "message": "Context evidence was captured"
}
